{
  "$schema": "https://json-schema.org/draft/2020-12/schema",
  "$id": "https://theparitt.github.io/sppa-protocol/schemas/0.1.1/health.schema.json",
  "title": "SPPA health (Draft 0.1.1)",
  "type": "object",
  "properties": {
    "provider_id": {
      "type": "string",
      "pattern": "^[a-z0-9]+(?:[.-][a-z0-9]+)+$",
      "maxLength": 128
    },
    "status": {
      "type": "string",
      "enum": [
        "healthy",
        "degraded",
        "unavailable"
      ]
    },
    "observed_at": {
      "type": "string",
      "format": "date-time",
      "pattern": "^\\d{4}-\\d{2}-\\d{2}T\\d{2}:\\d{2}:[0-5]\\d(?:\\.\\d{1,3})?Z$"
    },
    "valid_until": {
      "type": "string",
      "format": "date-time",
      "pattern": "^\\d{4}-\\d{2}-\\d{2}T\\d{2}:\\d{2}:[0-5]\\d(?:\\.\\d{1,3})?Z$"
    },
    "queue_depth": {
      "type": "integer",
      "minimum": 0,
      "maximum": 9007199254740991
    },
    "active_jobs": {
      "type": "integer",
      "minimum": 0,
      "maximum": 9007199254740991
    },
    "max_concurrency": {
      "type": "integer",
      "minimum": 1
    },
    "source": {
      "type": "string",
      "enum": [
        "provider",
        "synthetic"
      ]
    },
    "extensions": {
      "type": "object",
      "propertyNames": {
        "pattern": "^[a-z0-9]+(?:\\.[a-z0-9_-]+)+$"
      },
      "additionalProperties": true
    },
    "capabilities": {
      "type": "array",
      "items": {
        "$ref": "https://theparitt.github.io/sppa-protocol/schemas/0.1.1/capacity.schema.json"
      },
      "minItems": 1,
      "uniqueItems": true
    }
  },
  "required": [
    "provider_id",
    "status",
    "observed_at",
    "valid_until",
    "queue_depth",
    "active_jobs",
    "max_concurrency",
    "source",
    "capabilities"
  ],
  "additionalProperties": false
}
