{
  "provider_id": "com.example.ffmpeg",
  "status": "healthy",
  "observed_at": "2026-10-03T05:00:00Z",
  "valid_until": "2026-10-03T05:01:00Z",
  "queue_depth": 0,
  "active_jobs": 0,
  "max_concurrency": 2,
  "source": "provider",
  "capabilities": [
    {
      "capability": "video.transcode",
      "capability_version": "1.0.0",
      "accepting_jobs": true,
      "capacity": {
        "max_concurrency": 2,
        "running": 0,
        "available": 2
      },
      "queue": {
        "depth": 0,
        "max_depth": 64
      }
    }
  ]
}
